{
  "registry_id": "registry://cal0/i3-parameters@1",
  "version": "1",
  "lifecycle": "ACTIVE",
  "calibration_status": "PROVISIONAL_UNCALIBRATED",
  "scope_contract": "Every input required by the five CAL0-I3 reference scenarios is represented by one typed binding. PROVISIONAL values are low-confidence authoring priors, DISTRIBUTED values are bounded rehearsal distributions, SCENARIO values are reference-only assumptions, LOCKED values are mathematical conventions, and UNRESOLVED values require later evidence. None is a calibrated demographic or story-canon claim.",
  "definitions": [
    {"parameter_id": "parameter://cal0/maturation/anchor-coordinates@1", "group": "maturation", "meaning": "Shared developmental coordinates for reference PCHIP programmes", "owner": "CAL0", "classification": "LOCKED_TOPOLOGY", "value_type": "exact_decimal_sequence", "units": "developmental_coordinate", "domain": {"length": 4, "minimum": "0", "maximum": "1", "strictly_increasing": true}, "boundary_behaviour": "clamp only in declared reference scenarios", "precision": "0.0001", "provenance": ["litrpg-system-calibration-annex.md#CAL0-Q1B", "litrpg-system-calibration-annex.md#CAL0-I3"], "version": "1"},
    {"parameter_id": "parameter://cal0/maturation/physical-programme@1", "group": "maturation", "meaning": "Normalised physical maturation programme at the shared anchors", "owner": "CAL0", "classification": "PROVISIONAL_COEFFICIENT", "value_type": "exact_decimal_sequence", "units": "normalised_foundation", "domain": {"length": 4, "minimum": "0", "maximum": "1", "nondecreasing": true}, "boundary_behaviour": "PCHIP interpolation; no extrapolation", "precision": "0.0001", "provenance": ["litrpg-system-calibration-annex.md#CAL0-Q1B", "litrpg-system-calibration-annex.md#CAL0-I3"], "version": "1"},
    {"parameter_id": "parameter://cal0/maturation/neural-programme@1", "group": "maturation", "meaning": "Normalised neural maturation programme at the shared anchors", "owner": "CAL0", "classification": "PROVISIONAL_COEFFICIENT", "value_type": "exact_decimal_sequence", "units": "normalised_foundation", "domain": {"length": 4, "minimum": "0", "maximum": "1", "nondecreasing": true}, "boundary_behaviour": "PCHIP interpolation; no extrapolation", "precision": "0.0001", "provenance": ["litrpg-system-calibration-annex.md#CAL0-Q1B", "litrpg-system-calibration-annex.md#CAL0-I3"], "version": "1"},
    {"parameter_id": "parameter://cal0/maturation/soul-programme@1", "group": "maturation", "meaning": "Normalised embodied soul-integration programme at the shared anchors", "owner": "CAL0", "classification": "PROVISIONAL_COEFFICIENT", "value_type": "exact_decimal_sequence", "units": "normalised_foundation", "domain": {"length": 4, "minimum": "0", "maximum": "1", "nondecreasing": true}, "boundary_behaviour": "PCHIP interpolation; no extrapolation", "precision": "0.0001", "provenance": ["litrpg-system-calibration-annex.md#CAL0-Q1B", "litrpg-system-calibration-annex.md#CAL0-I3"], "version": "1"},
    {"parameter_id": "parameter://cal0/maturation/structural-gate-programme@1", "group": "maturation", "meaning": "Normalised structural expression gate over prenatal-to-birth development", "owner": "CAL0", "classification": "PROVISIONAL_COEFFICIENT", "value_type": "exact_decimal_sequence", "units": "fraction", "domain": {"length": 4, "minimum": "0", "maximum": "1", "nondecreasing": true}, "boundary_behaviour": "clamp to [0,1]", "precision": "0.0001", "provenance": ["litrpg-system-calibration-annex.md#CAL0-Q2B", "litrpg-system-calibration-annex.md#CAL0-I3"], "version": "1"},
    {"parameter_id": "parameter://cal0/maturation/timing-offset-bound@1", "group": "maturation", "meaning": "Maximum magnitude of bounded component timing residual", "owner": "CAL0", "classification": "PROVISIONAL_COEFFICIENT", "value_type": "exact_decimal", "units": "developmental_coordinate", "domain": {"minimum": "0", "maximum": "0.20", "minimum_inclusive": true, "maximum_inclusive": true}, "boundary_behaviour": "symmetric bounded offset", "precision": "0.0001", "provenance": ["litrpg-system-calibration-annex.md#CAL0-Q10B", "litrpg-system-calibration-annex.md#CAL0-I3"], "version": "1"},
    {"parameter_id": "parameter://cal0/maturation/foundation-rise-rate@1", "group": "maturation", "meaning": "Reference rate at which realised foundation approaches a higher target", "owner": "CAL0", "classification": "PROVISIONAL_COEFFICIENT", "value_type": "exact_decimal", "units": "per_developmental_coordinate", "domain": {"minimum": "0", "maximum": "4", "minimum_inclusive": false, "maximum_inclusive": true}, "boundary_behaviour": "non-negative rise only", "precision": "0.0001", "provenance": ["litrpg-system-calibration-annex.md#CAL0-Q2B", "litrpg-system-calibration-annex.md#CAL0-I3"], "version": "1"},
    {"parameter_id": "parameter://cal0/maturation/foundation-loss-rate@1", "group": "maturation", "meaning": "Reference rate at which realised foundation approaches a lower target after disruption", "owner": "CAL0", "classification": "PROVISIONAL_COEFFICIENT", "value_type": "exact_decimal", "units": "per_developmental_coordinate", "domain": {"minimum": "0", "maximum": "4", "minimum_inclusive": true, "maximum_inclusive": true}, "boundary_behaviour": "non-negative loss only", "precision": "0.0001", "provenance": ["litrpg-system-calibration-annex.md#CAL0-Q2B", "litrpg-system-calibration-annex.md#CAL0-I3"], "version": "1"},
    {"parameter_id": "parameter://cal0/maturation/aggregate-rho@1", "group": "maturation", "meaning": "Generalised-mean substitution parameter for physical capacity aggregation", "owner": "CAL0", "classification": "PROVISIONAL_COEFFICIENT", "value_type": "exact_decimal", "units": "dimensionless", "domain": {"minimum": "-2", "maximum": "1", "minimum_inclusive": true, "maximum_inclusive": true}, "boundary_behaviour": "rho zero uses the geometric mean", "precision": "0.0001", "provenance": ["litrpg-system-calibration-annex.md#CAL0-Q3B", "litrpg-system-calibration-annex.md#CAL0-I3"], "version": "1"},
    {"parameter_id": "parameter://cal0/maturation/aggregate-weights@1", "group": "maturation", "meaning": "Reference physical, neural, and metabolic aggregation weights", "owner": "CAL0", "classification": "PROVISIONAL_COEFFICIENT", "value_type": "exact_decimal_map", "units": "fraction", "domain": {"keys": ["metabolic", "neural", "physical"], "minimum": "0", "maximum": "1", "sum": "1"}, "boundary_behaviour": "reject missing, negative, or non-normalised maps", "precision": "0.0001", "provenance": ["litrpg-system-calibration-annex.md#CAL0-Q3B", "litrpg-system-calibration-annex.md#CAL0-I3"], "version": "1"},
    {"parameter_id": "parameter://cal0/maturation/species-scale@1", "group": "maturation", "meaning": "Human reference-species capacity scale", "owner": "CAL0", "classification": "LOCKED_TOPOLOGY", "value_type": "exact_decimal", "units": "human_reference_capacity", "domain": {"minimum": "0", "maximum": "4", "minimum_inclusive": false, "maximum_inclusive": true}, "boundary_behaviour": "positive scale only", "precision": "0.0001", "provenance": ["litrpg-system-calibration-annex.md#CAL0-Q3B", "litrpg-system-calibration-annex.md#CAL0-I3"], "version": "1"},

    {"parameter_id": "parameter://cal0/adaptation/maintenance@1", "group": "adaptation", "meaning": "Lower challenge boundary below which load is maintenance rather than productive adaptation", "owner": "CAL0", "classification": "PROVISIONAL_COEFFICIENT", "value_type": "exact_decimal", "units": "relative_challenge", "domain": {"minimum": "0", "maximum": "2", "minimum_inclusive": true, "maximum_inclusive": true}, "boundary_behaviour": "ordered hormetic boundary", "precision": "0.0001", "provenance": ["litrpg-system-calibration-annex.md#CAL0-Q11B", "litrpg-system-calibration-annex.md#CAL0-I3"], "version": "1"},
    {"parameter_id": "parameter://cal0/adaptation/peak@1", "group": "adaptation", "meaning": "Reference productive-challenge peak", "owner": "CAL0", "classification": "PROVISIONAL_COEFFICIENT", "value_type": "exact_decimal", "units": "relative_challenge", "domain": {"minimum": "0", "maximum": "2", "minimum_inclusive": true, "maximum_inclusive": true}, "boundary_behaviour": "ordered hormetic boundary", "precision": "0.0001", "provenance": ["litrpg-system-calibration-annex.md#CAL0-Q11B", "litrpg-system-calibration-annex.md#CAL0-I3"], "version": "1"},
    {"parameter_id": "parameter://cal0/adaptation/excessive@1", "group": "adaptation", "meaning": "Challenge boundary above which injury or maladaptation risk begins", "owner": "CAL0", "classification": "PROVISIONAL_COEFFICIENT", "value_type": "exact_decimal", "units": "relative_challenge", "domain": {"minimum": "0", "maximum": "2", "minimum_inclusive": true, "maximum_inclusive": true}, "boundary_behaviour": "ordered hormetic boundary", "precision": "0.0001", "provenance": ["litrpg-system-calibration-annex.md#CAL0-Q11B", "litrpg-system-calibration-annex.md#CAL0-I3"], "version": "1"},
    {"parameter_id": "parameter://cal0/adaptation/stop@1", "group": "adaptation", "meaning": "Hard challenge boundary at which productive opportunity is zero", "owner": "CAL0", "classification": "PROVISIONAL_COEFFICIENT", "value_type": "exact_decimal", "units": "relative_challenge", "domain": {"minimum": "0", "maximum": "3", "minimum_inclusive": true, "maximum_inclusive": true}, "boundary_behaviour": "ordered hormetic boundary", "precision": "0.0001", "provenance": ["litrpg-system-calibration-annex.md#CAL0-Q11B", "litrpg-system-calibration-annex.md#CAL0-I3"], "version": "1"},